<?xml version="1.0" encoding="utf-8"?>
<!DOCTYPE nfeProc SYSTEM "notas.dtd">
<nfeProc>
	<NFe xmlns="http://www.portalfiscal.inf.br/nfe">
		<infNFe Id="NFe35130743708379006485550050005663981000000013" versao="2.00">
			<ide>
				<cUF>35</cUF>
				<cNF>00000001</cNF>
				<natOp>VENDA MERC.SUBTRB.UF VM</natOp>
				<indPag>0</indPag>
				<mod>55</mod>
				<serie>5</serie>
				<nNF>566398</nNF>
				<dEmi>2013-07-02</dEmi>
				<tpNF>1</tpNF>
				<cMunFG>3509205</cMunFG>
				<tpImp>2</tpImp>
				<tpEmis>1</tpEmis>
				<cDV>3</cDV>
				<tpAmb>1</tpAmb>
				<finNFe>1</finNFe>
				<procEmi>0</procEmi>
				<verProc>NeoGrid NFe 1.16.1.1</verProc>
			</ide>
			<emit>
				<CNPJ>43708379006485</CNPJ>
				<xNome>FAST SHOP S.A.</xNome>
				<xFant>FAST SHOP S.A.</xFant>
				<enderEmit>
					<xLgr>ANHANGUERA</xLgr>
					<nro>S.N</nro>
					<xCpl>KM 37.5</xCpl>
					<xBairro>JORDANESIA</xBairro>
					<cMun>3509205</cMun>
					<xMun>CAJAMAR</xMun>
					<UF>SP</UF>
					<CEP>07750000</CEP>
					<cPais>1058</cPais>
					<xPais>Brasil</xPais>
					<fone>1132323200</fone>
				</enderEmit>
				<IE>241091299113</IE>
				<CRT>3</CRT>
			</emit>
			<dest>
				<CPF>12345678900</CPF>
				<xNome>GIOVANI LIBRELOTTO</xNome>
				<enderDest>
					<xLgr>AV RORAIMA</xLgr>
					<nro>1000</nro>
					<xCpl>SALA 387</xCpl>
					<xBairro>CAMOBI</xBairro>
					<cMun>4316907</cMun>
					<xMun>SANTA MARIA</xMun>
					<UF>RS</UF>
					<CEP>97010041</CEP>
					<cPais>1058</cPais>
					<xPais>Brasil</xPais>
					<fone>5591234567</fone>
				</enderDest>
				<IE>ISENTO</IE>
				<email>librelotto@mail.com</email>
			</dest>
			<entrega>
				<CPF>12345678900</CPF>
				<xLgr>AV RORAIMA</xLgr>
				<nro>1000</nro>
				<xCpl>SALA 387</xCpl>
				<xBairro>CAMOBI</xBairro>
				<cMun>4316907</cMun>
				<xMun>SANTA MARIA</xMun>
				<UF>RS</UF>
			</entrega>
			<det nItem="1">
				<prod>
					<cProd>LG47LM6400</cProd>
					<cEAN>7893299100079</cEAN>
					<xProd>SMART TV LED LCD 3D FHD 47P | 7893299100079| Rua: A</xProd>
					<NCM>85287200</NCM>
					<CFOP>6404</CFOP>
					<uCom>PC</uCom>
					<qCom>1.0000</qCom>
					<vUnCom>2387.6800</vUnCom>
					<vProd>2387.68</vProd>
					<cEANTrib>7893299100079</cEANTrib>
					<uTrib>PC</uTrib>
					<qTrib>1.0000</qTrib>
					<vUnTrib>2387.6800</vUnTrib>
					<vFrete>51.80</vFrete>
					<indTot>1</indTot>
				</prod>
				<imposto>
					<ICMS>
						<ICMS60>
							<orig>4</orig>
							<CST>60</CST>
							<vBCSTRet>2651.00</vBCSTRet>
							<vICMSSTRet>117.18</vICMSSTRet>
						</ICMS60>
					</ICMS>
					<PIS>
						<PISAliq>
							<CST>01</CST>
							<vBC>2439.48</vBC>
							<pPIS>1.65</pPIS>
							<vPIS>40.25</vPIS>
						</PISAliq>
					</PIS>
					<COFINS>
						<COFINSAliq>
							<CST>01</CST>
							<vBC>2439.48</vBC>
							<pCOFINS>7.60</pCOFINS>
							<vCOFINS>185.40</vCOFINS>
						</COFINSAliq>
					</COFINS>
				</imposto>
			</det>
			<total>
				<ICMSTot>
					<vBC>0.00</vBC>
					<vICMS>0.00</vICMS>
					<vBCST>0.00</vBCST>
					<vST>0.00</vST>
					<vProd>2387.68</vProd>
					<vFrete>51.80</vFrete>
					<vSeg>0.00</vSeg>
					<vDesc>0.00</vDesc>
					<vII>0.00</vII>
					<vIPI>0.00</vIPI>
					<vPIS>40.25</vPIS>
					<vCOFINS>185.40</vCOFINS>
					<vOutro>0.00</vOutro>
					<vNF>2439.48</vNF>
				</ICMSTot>
			</total>
			<transp>
				<modFrete>1</modFrete>
				<transporta>
					<CNPJ>02058135000303</CNPJ>
					<xNome>JOAO LUIZ DOS SANTOS LAGUNA</xNome>
					<IE>149732186112</IE>
					<xEnder>R SD JOSE PIRES BARBOSA FILHO 24</xEnder>
					<xMun>SAO PAULO</xMun>
					<UF>SP</UF>
				</transporta>
				<vol>
					<qVol>1</qVol>
					<esp>volume</esp>
					<pesoL>20.900</pesoL>
					<pesoB>20.900</pesoB>
				</vol>
			</transp>
			<infAdic>
				<infCpl>Pedido: 145545 Tabela: 58 Vendedor: V102526 Usuario: TEFSITE Val. Aproximado
                    dos Tributos - R$975,61 (40,86%). Fonte: IBPT. Obs: G: 000 00 Em ate 7 dias apos
                    a entrega, se o produto apresentar defeito, a troca podera ser efetuada
                    diretamente em qualquer das lojas da FAST SHOP no mesmo Estado de emissao do
                    documento fiscal, desde que ausentes avarias ou danos aparentes, sem laudo
                    tecnico ou procedimento de garantia previsto nos artigos 18 a 26 do Codigo de
                    Defesa do Consumidor. A troca se dara mediante apresentacao da nota fiscal,
                    embalagem original e acessorios. Essa troca em 7 dias, nas lojas, e sem maiores
                    formalidades, e um especial beneficio aos nossos clientes, independentemente dos
                    termos e prazos das garantias legal e/ou contratual previstas para o
                    produto/servico (artigos 18 a 26 da lei 8.078/90). Substituicao Trib.ICMS item 1
                    cf. RICMS Art 313-Z19</infCpl>
			</infAdic>
		</infNFe>
		<Signature xmlns="http://www.w3.org/2000/09/xmldsig#">
			<SignedInfo>
				<CanonicalizationMethod Algorithm="http://www.w3.org/TR/2001/REC-xml-c14n-20010315"/>
				<SignatureMethod Algorithm="http://www.w3.org/2000/09/xmldsig#rsa-sha1"/>
				<Reference URI="#NFe35130743708379006485550050005663981000000013">
					<Transforms>
						<Transform Algorithm="http://www.w3.org/2000/09/xmldsig#enveloped-signature"/>
						<Transform Algorithm="http://www.w3.org/TR/2001/REC-xml-c14n-20010315"/>
					</Transforms>
					<DigestMethod Algorithm="http://www.w3.org/2000/09/xmldsig#sha1"/>
					<DigestValue>s/uixIqU3qCYCsOaUntT3SsED3s=</DigestValue>
				</Reference>
			</SignedInfo>
			<SignatureValue>q5ez8xm5VTJaEymoYaly4x4MHyhmwPNpKhLAofFM7Ft8Y+wCvvX+Bh2O+Nvnlg0NXEFTOkYzErZ0AeEz9G/9X5CT3LX1R9iQ+sg81zMbiotPxac0VY1NVqm12Lz3s7+XnqYXOw4141rkOwDWHw2mcwkDIdELER9D13KFv6ERE0poUGkeVki4hRHbuES7WNBMFWNB+hYvQ2I/Yn33xX1jMIx41d1oqaV+cWCau+Hx9o20Ofd9YOvOEmy9Dwdo2eArLqzWYAsjHhlrYapDeubpXpSoc4qF6F1mWmMCwDBh3MXH1ejoeUqdJGG0EMIw/8pfHGk5S6QZ6aMvG0hsUCJcyQ==</SignatureValue>
			<KeyInfo>
				<X509Data>
					<X509Certificate>MIIIQjCCBiqgAwIBAgIQDm0R6qTsIXspQjoXR5Z33TANBgkqhkiG9w0BAQsFADB0MQswCQYDVQQGEwJCUjETMBEGA1UEChMKSUNQLUJyYXNpbDEtMCsGA1UECxMkQ2VydGlzaWduIENlcnRpZmljYWRvcmEgRGlnaXRhbCBTLkEuMSEwHwYDVQQDExhBQyBDZXJ0aXNpZ24gTXVsdGlwbGEgRzUwHhcNMTIwODI4MDAwMDAwWhcNMTMwODI3MjM1OTU5WjCB0DELMAkGA1UEBhMCQlIxEzARBgNVBAoUCklDUC1CcmFzaWwxODA2BgNVBAsUL0F1dGVudGljYWRvIHBvciBDZXJ0aXNpZ24gQ2VydGlmaWNhZG9yYSBEaWdpdGFsMRswGQYDVQQLFBJBc3NpbmF0dXJhIFRpcG8gQTExFTATBgNVBAsUDElEIC0gMzU0NDQwMzEWMBQGA1UEAxMNRmFzdCBTaG9wIFMgQTEmMCQGCSqGSIb3DQEJARYXaW5mcmF0aUBmYXN0c2hvcC5jb20uYnIwggEiMA0GCSqGSIb3DQEBAQUAA4IBDwAwggEKAoIBAQC8DuxgkTaOwF4ibXU2Z43Po6bYOfeLwWQxlrv8wNnwgCtXYw8EdIIda+JB3sPhA8QH1ld9XFCw4r+UC1EBppNJVRdAcn9LNUxC6zzka7CLPtDRXw12a+dh2AhSehMGGOs9mTTMo4z3osAheckv4Z1N3doEJgHy9YbJyV52+546KGs3/SjwEelxP04Rb3qtADqXdfRL6R+v6v/DfePWjH/5RQdi8JVJZKhf6qGWfYGLBfjutZc7JSr1CUEiffTNXptrTGkZmvkMJ809LQGvGSIrJ4CpJGmf1DWn0P46Npd90NkTBVvC+c5jZZ9jTLtXBXMb6Yp1Ry9WvzXotumq8f/xAgMBAAGjggNxMIIDbTCBtwYDVR0RBIGvMIGsoDgGBWBMAQMEoC8ELTAyMDMxOTU2MDAxNzk5MjM4OTcwMDAwMDAwMDAwMDAwMDAwMDAwMDAwMDAwMKAjBgVgTAEDAqAaBBhNSUxUT04gS0FaVVlVS0kgS0FLVU1PVE+gGQYFYEwBAwOgEAQONDM3MDgzNzkwMDAxMDCgFwYFYEwBAwegDgQMMDAwMDAwMDAwMDAwgRdpbmZyYXRpQGZhc3RzaG9wLmNvbS5icjAJBgNVHRMEAjAAMB8GA1UdIwQYMBaAFJ1Qz73/JMqvsTPrF+JCeo5pKo5TMA4GA1UdDwEB/wQEAwIF4DCBiQYDVR0gBIGBMH8wfQYGYEwBAgELMHMwcQYIKwYBBQUHAgEWZWh0dHA6Ly9pY3AtYnJhc2lsLmNlcnRpc2lnbi5jb20uYnIvcmVwb3NpdG9yaW8vZHBjL0FDX0NlcnRpc2lnbl9NdWx0aXBsYS9EUENfQUNfQ2VydGlTaWduTXVsdGlwbGEucGRmMIIBJQYDVR0fBIIBHDCCARgwXKBaoFiGVmh0dHA6Ly9pY3AtYnJhc2lsLmNlcnRpc2lnbi5jb20uYnIvcmVwb3NpdG9yaW8vbGNyL0FDQ2VydGlzaWduTXVsdGlwbGFHNS9MYXRlc3RDUkwuY3JsMFugWaBXhlVodHRwOi8vaWNwLWJyYXNpbC5vdXRyYWxjci5jb20uYnIvcmVwb3NpdG9yaW8vbGNyL0FDQ2VydGlzaWduTXVsdGlwbGFHNS9MYXRlc3RDUkwuY3JsMFugWaBXhlVodHRwOi8vcmVwb3NpdG9yaW8uaWNwYnJhc2lsLmdvdi5ici9sY3IvQ2VydGlzaWduL0FDQ2VydGlzaWduTXVsdGlwbGFHNS9MYXRlc3RDUkwuY3JsMB0GA1UdJQQWMBQGCCsGAQUFBwMCBggrBgEFBQcDBDCBoAYIKwYBBQUHAQEEgZMwgZAwZAYIKwYBBQUHMAKGWGh0dHA6Ly9pY3AtYnJhc2lsLmNlcnRpc2lnbi5jb20uYnIvcmVwb3NpdG9yaW8vY2VydGlmaWNhZG9zL0FDX0NlcnRpc2lnbl9NdWx0aXBsYV9HNS5wN2MwKAYIKwYBBQUHMAGGHGh0dHA6Ly9vY3NwLmNlcnRpc2lnbi5jb20uYnIwDQYJKoZIhvcNAQELBQADggIBACl4Y5pqf5tvgXmcWYuWVMB5CnF8QUzYTMzIr6OcHJthybSjHCwNvKTY1jSeq2rqW/SuagkjuwTNrIGcY+4QYhb+gkc4z0dEtPcwCcrBSOSwYQ0cl5Q07+VD3crCUpoP14wKHJpzE3CW5n2MrK9rz326LD0UaVGV3yUChi5FjvyKW0/FqDmmRacbR1Z0RsZ5/upln8jDmC7lJv4QQh3mFQCzivLlrSuTztPRocwPpGi7a5edCgKhxiYddLPPPuuE70PtFYlSXOCc12GjXuD5cDEsA+kGDXpB2sG4Q1r/KFcnwMz1KdvY70+WaiJ4ygvSRkj+XA72EjPj1bhBwybOG4Fu/uGWOTslpf2p88UjH4Bk4XnFtU/EaP51DEeoW+R84DaTd13Doi5Ba+SN1X27wFG34RfMUEc8GqIamZdAuRgg8wbrhcU2cpEi80paqCWTvIGf9jEt8rWZHgl/gFf+e1Rv4iLnJliVZquSUr/hI324F7Q2tYpQqmhAbZvMn4gTP00FVF2aMQgYtJEJNjH2NkV4ZONCXs7z+7YI9FfHc11KLu/N0KybzfIHSeiS/SUfkqi3yvHW2Oo+VLrX/vbO+c+5BT3IHoWQimeN7LJzi5pkpXVXHFZcEinpECTFH30rL7HY3ndUTHGg/ktHlXUuNoE1jM/y5Wi9X3nOHkRoUKL6</X509Certificate>
				</X509Data>
			</KeyInfo>
		</Signature>
	</NFe>
	<protNFe versao="2.00">
		<infProt>
			<tpAmb>1</tpAmb>
			<verAplic>5.0</verAplic>
			<chNFe>35130743708379006485550050005663981000000013</chNFe>
			<dhRecbto>2013-07-02T17:56:14</dhRecbto>
			<nProt>135130390612170</nProt>
			<digVal>s/uixIqU3qCYCsOaUntT3SsED3s=</digVal>
			<cStat>100</cStat>
			<xMotivo>Autorizado o uso da NF-e</xMotivo>
		</infProt>
	</protNFe>
</nfeProc>
